id,GroupName,Prefectures,PostalCode,Address,TelephoneNumber,Email,HomePage,Philosophy,Product,Deadline,Condition,Offer,NorthLa-EastLon
112,社会福祉法人 南苑会 フードバンク熊本,熊本県,861-4117,熊本県熊本市南区護藤町 973,096-357-5622,fujitomi@poppy.ocn.ne.jp,http://k-fujitomi.com/foodbank.php,#N/A,加工食品（常温）、加工食品（冷蔵）、加工食品（冷凍）、農産物など,60,賞味期限が２ヶ月以上残っているもの,児童養護施設、母子生活支援施設、自立援助ホーム、更生支援施設、障害者施設、生活困窮者支援団体、個人支援、炊き出し、老人施設、グループホーム、災害支援団体、学校外学習生活支援団体、子ども食堂等,"[32.7833323, 130.7333361]"
113,フードバンク玉名,熊本県,865-8501,熊本県玉名市岩崎 163,0968-75-1222,kurasapo@city.tamana.lg.jp,http://www.city.tamana.lg.jp/q/aview/53/7268.htm/,社会における「もったいない」を「ありがとう」に変えるべく、困窮状態にある方の今日を支えると共に、新しい地域づくりと企業等の社会貢献を手助けし、誰もが安心して暮らせる社会の実現を目的とする。,加工食品（常温）,90,賞味期限が３ヶ月以上残っているもの,個人支援、学校外学習生活支援団体,"[32.9352591, 130.5628137]"
114,社会福祉法人 大分県社会福祉協議会 フードバンクおお いた,大分県,870-0907,大分県大分市大津町 2－1－41,097-558-3373,oitavoc@oitavoc.jp,https://fboita.oitakensyakyo.jp/,「もったいない」を「ありがとう」に。,加工食品（常温）、加工食品（冷蔵）、加工食品（冷凍）、 農産物,30,賞味期限が１ヶ月以上残っているもの,児童養護施設、母子生活支援施設、自立援助ホーム、更生支援施設、生活困窮者支援団体、子ども食堂等,"[33.2393864, 131.6096524]"
115,一般社団法人 大分こころのケアセンター フードバンク 東九州,大分県,870-0251,大分県大分市大在中央一丁目 12 番 4－302 号,097-592-7302,oitafood@kokono-care-center.or.jp,https://kokono-care-center.or.jp,・精神障害者と引きこもりの方の社会参加と社会貢献への支援。・食品ロス削減、ＣＯ２排出削減、格差縮少。,加工食品（常温）、加工食品（冷蔵）、加工食品（冷凍）、農産物、水産物・畜産物など,1,賞味期限が１週間以内であっても、賞味期限までの日数が残っているもの,児童養護施設、個人支援、炊き出し、子ども食堂,"[33.2393864, 131.6096524]"
116,フードバンクお助けマン霧島,鹿児島県,899-5121,鹿児島県霧島市隼人町神宮1-6-5,0995-42-3212,joystation@po.mct.ne.jp,http://npo-joystation.com/,フードバンク活動を通じて分かち合いの精神を実践して「食品ロス削減」運動に企業と個人が参加できるシステムを構築することを目的に活動しています。,加工食品（常温）、加工食品(冷蔵・チルド）、野菜・果物、菓子、清涼飲料、日用品・雑貨・衣類,30,配布食品は未開封・未使用、賞味期限１カ月前,子ども食堂、児童クラブ、児童養護施設、老人施設、自立援助ホーム、障害者施設、生活困窮者支援団体、地方公共団体、民生委員,"[31.521587, 130.5474077]"
117,フードバンク日向,宮崎県,883-0034,宮崎県日向市富高 6800－35,090-1192-9815,on_the_move_a@yahoo.co.jp,https://www.fb-hyuga.com/,誰もが食を分かち合える社会の実現。生まれてきた環境により満足に食事が摂れない。十分に教育が受けられない寂しい思いをしているこどもを日向市からゼロにする。,加工食品（常温）、加工食品（冷蔵）、加工食品（冷凍）、農産物、水産物・畜産物など,30,賞味期限が１ヶ月以上残っているものなど,児童養護施設、個人支援、子ども食堂等,"[32.097681, 131.294542]"
118,ＮＰＯ法人フードバンクかごしま,鹿児島県,892-0831,鹿児島県鹿児島市船津町 1－11,099-226-9298,foodbank@ksnk.org,http://ksnk.org/,#N/A,加工食品（常温）、加工食品（冷蔵）、加工食品（冷凍）、農産物,#N/A,#N/A,児童養護施設、母子生活支援施設、更生支援施設、障害者施設、生活困窮者支援団体、炊き出し、災害支援団体、子ども食堂等,"[31.6020649, 130.5641252]"
119,一般社団法人サポートセンターＨＯＰＥフードバンクやいま,沖縄県,907-0002,沖縄県石垣市字真栄里 204－32 1－E,0980-88-6260,hope.okinawa@outlook.jp,https://ishigakihope.com/,子どもを守り母親と家族を励まし支える。,加工食品（常温）,30,賞味期限が１ヶ月以上残っているもの,#N/A,"[24.366098, 124.163499]"
120,ＮＰＯ法人フードバンクセカンドハーベスト沖縄,沖縄県,902-0073,沖縄県那覇市上間 200－1 ダイエイ A101,098-853-3001,info@2h-okinawa.org,https://www.2h-okinawa.org/,もったいない食品等を生かし、沖縄の中で困っている人たちに無償で食品を届ける活動。,加工食品（常温）、加工食品（冷蔵）、加工食品（冷凍）、農産物、水産物・畜産物など,30,賞味期限が１ヶ月以上残っているものなど,児童養護施設、母子生活支援施設、シェルター、自立援助ホーム、更生支援施設、障害者施設、生活困窮者支援団体、個人支援、老人施設、グループホーム、学校外学習生活支援団体、子ども食堂等,"[26.2122345, 127.6791452]"
